name,price,price_per_kg,category,date
Tesco Rice Cakes Milk Chocolate 105G,1.75,£16.67/kg,milk,2026-03-31
SuperNutrio High Protein Fresh Semi Skimmed Milk 1l,2.25,£2.25/litre,milk,2026-03-31
Delamere Dairy Sterilised Semi-Skimmed Milk 1 Litre,1.2,£1.20/litre,milk,2026-03-31
Lindt Lindor Milk Chocolate Egg with Milk Truffles 183g,12.0,£65.57/kg,milk,2026-03-31
Lindt Milk Chocolate Egg With Lindor Milk Truffels 348G,22.0,£63.22/kg,milk,2026-03-31
Lindt Lindor Milk Chocolate Egg with Milk Truffles 260g,15.0,£57.69/kg,milk,2026-03-31
Tesco British Beef Medium Roasting Joint,12.0,£20.00/kg,beef,2026-04-01
Tesco Diced Beef 400G,4.49,£11.22/kg,beef,2026-04-01
Tesco British Roast Beef Slices 90g,2.25,£25.00/kg,beef,2026-04-01
Tesco Finest Beef Roasting Joint,15.75,£21.00/kg,beef,2026-04-01
Tesco Thin Cut Beef Steaks 395G,4.5,£11.39/kg,beef,2026-04-01
Tesco Beef Brisket,10.5,£17.50/kg,beef,2026-04-01
Tesco Large Beef Roasting Joint With Basting Fat,18.0,£18.00/kg,beef,2026-04-01
Tesco Lean Beef Steak Mince 5% Fat 500g,5.19,£10.38/kg,beef,2026-04-01
Tesco Finest Topside of Beef - Charred 90g,3.75,£41.67/kg,beef,2026-04-01
Tesco Lean Diced Beef 600G,8.0,£13.33/kg,beef,2026-04-01
Tesco Beef Brisket In Gravy 380G,5.6,£14.74/kg DR.WT,beef,2026-04-01
Tesco Beef Stir Fry Strips 357G,6.4,£17.93/kg,beef,2026-04-01
Tesco Lean Beef Steak Mince 5% Fat 250G,2.69,£10.76/kg,beef,2026-04-01
Tesco Stewing Steak 400G,4.45,£11.12/kg,beef,2026-04-01
Tesco 2 Beef Medallion Steaks 340G,4.9,£14.41/kg,beef,2026-04-01
Tesco Beef Mince 20% Fat 500g,3.25,£6.50/kg,beef,2026-04-01
Tesco Finest Finely Sliced Roast Beef Brisket 90g,3.75,£41.67/kg,beef,2026-04-01
Tesco Lean Beef Steak Mince 5% Fat 750g,7.5,£10.00/kg,beef,2026-04-01
Tesco Carvery Beef Joint,8.99,£9.99/kg,beef,2026-04-01
Tesco Slow Roasting Beef Joint,18.0,£18.00/kg,beef,2026-04-01
Tesco British Corned Beef 110g,2.25,£20.46/kg,beef,2026-04-01
Tesco Finest Diced Beef 400G,7.4,£18.50/kg,beef,2026-04-01
Tesco Beef Medallion Steak 227G,3.29,£14.49/kg,beef,2026-04-01
Tesco Beef Rump Steak 255G,4.45,£17.45/kg,beef,2026-04-01
Knorr Rich Beef Stock Pot 4 x 28g,1.95,£17.41/kg,beef,2026-04-01
Tesco Beef Meatballs 12 Pack 336g,3.95,£11.76/kg,beef,2026-04-01
Eastmans Corned Beef Slices 150g,1.5,£10.00/kg,beef,2026-04-01
Tesco Slow Cooked Tennesse Style Boneless Beef 370g,5.6,£15.14/kg,beef,2026-04-01
Tesco Beef Gravy Granules 200G,0.66,£3.30/kg,beef,2026-04-01
Tesco Beef Steaks with Peppercorn Sauce 320g,7.3,£22.81/kg,beef,2026-04-01
Tesco 4 Quarter Pounder Beef Burger 454g,4.0,£8.81/kg,beef,2026-04-01
Tesco Basted Beef Joint 751G,13.0,£17.31/kg,beef,2026-04-01
Tesco Beef Meatballs 24 Pack 672g,6.5,£9.67/kg,beef,2026-04-01
Tesco Beef Steak Mince 15% Fat 750g,7.1,£9.47/kg,beef,2026-04-01
Tesco Finest Slow Cooked Beef Bourguignon 540G,7.95,£14.72/kg,beef,2026-04-01
Tesco Finest 12 Beef & Herb Meatballs 336G,4.95,£14.73/kg,beef,2026-04-01
Tesco Beef Ribeye Steak 227G,6.85,£30.18/kg,beef,2026-04-01
Tesco Beef Tomatoes Each,0.87,£0.87/each,beef,2026-04-01
Schwartz Beef Casserole Recipe Mix 38g,1.0,£26.32/kg,beef,2026-04-01
Oxo Beef Stock Cubes 12 Pack 71g,2.65,£37.32/kg,beef,2026-04-01
Tesco Teriyaki Beef Brisket 370G,5.6,£15.14/kg,beef,2026-04-01
Tesco For Beef Gravy Granules 500g,1.6,£3.20/kg,beef,2026-04-01
Tesco 2 Beef Grill Steaks 300G,3.6,£12.00/kg,beef,2026-04-01
Tesco Beef Fillet Steak 170G,8.15,£47.94/kg,beef,2026-04-01
Bisto Best Beef Gravy Granules 230g,4.3,£18.70/kg,beef,2026-04-01
Tesco Finest 2 Beef Rump Steaks 510G,13.4,£26.28/kg,beef,2026-04-01
Tesco White Toastie Bread Thick Sliced 800g,0.75,£0.94/kg,bread,2026-04-01
Tesco Medium Sliced White Bread 800g,0.74,£0.92/kg,bread,2026-04-01
Hovis Soft White Medium Sliced Bread 800g,1.39,£1.74/kg,bread,2026-04-01
Warburtons Farmhouse Thick Sliced White Bread 800g,1.6,£2.00/kg,bread,2026-04-01
Warburtons Toastie Thick Sliced White Bread 800g,1.4,£1.75/kg,bread,2026-04-01
Tesco Wholemeal Medium Sliced Bread 800g,0.75,£0.94/kg,bread,2026-04-01
Hovis Seed Sensations Seven Seeds Sliced Bread 800g,2.0,£2.50/kg,bread,2026-04-01
Warburtons Tiger Bread Bloomer 600g,1.65,£2.75/kg,bread,2026-04-01
Warburtons Half And Half Medium Bread 800G,1.35,£1.69/kg,bread,2026-04-01
Warburtons Wholemeal Medium Sliced Bread 400g,0.99,£2.48/kg,bread,2026-04-01
Warburtons Toastie Thick and Small Sliced White Bread 400g,0.99,£2.48/kg,bread,2026-04-01
Hovis Soft White Thick Sliced Bread 800g,1.39,£1.74/kg,bread,2026-04-01
Hovis Best of Both Medium Bread 800g,1.15,£1.44/kg,bread,2026-04-01
Warburtons Wholemeal Medium Sliced Bread 800g,1.35,£1.69/kg,bread,2026-04-01
Warburtons Danish Lighter Small White Sliced Bread 400g,1.25,£3.12/kg,bread,2026-04-01
Warburtons Medium Sliced Soft White Bread 800g,1.4,£1.75/kg,bread,2026-04-01
H.W. Nevill's Medium Sliced Wholemeal Bread 800g,0.55,£0.69/kg,bread,2026-04-01
Tesco Finest Sunflower & Pumpkin Sliced White Bread Loaf 600g,1.4,£2.33/kg,bread,2026-04-01
Hovis Wholemeal Tasty Medium Bread 800g,1.35,£1.69/kg,bread,2026-04-01
Jason's Recipe No 08 White Sourdough Ciabattin Bread 580g,2.2,£3.79/kg,bread,2026-04-01
Tesco Finest Super Seeded Sliced Farmhouse Loaf 800g,1.6,£2.00/kg,bread,2026-04-01
Warburtons Thick Sliced Seeded Batch Bread 800g,1.9,£2.38/kg,bread,2026-04-01
Tesco Multiseed Batch Medium Sliced White Loaf 800g,1.25,£1.56/kg,bread,2026-04-01
Warburtons Baker's Bloomer White Bread 800g,1.8,£2.25/kg,bread,2026-04-01
H.W. Nevill's Medium Sliced White Bread 800g,0.55,£0.69/kg,bread,2026-04-01
Tesco Lightly Seeded White Bread Loaf 800g,1.0,£1.25/kg,bread,2026-04-01
Kingsmill 50/50 Medium Soft White Bread Loaf 800g,1.05,£1.31/kg,bread,2026-04-01
Tesco 10 Garlic Bread Slices 260G,1.25,£4.81/kg,bread,2026-04-01
Tesco Finest Dark Rye & Sunflower Farmhouse Sliced Bread 600g,1.4,£2.33/kg,bread,2026-04-01
Hovis Best of Both Thick Bread 800g,1.15,£1.44/kg,bread,2026-04-01
Hovis Authentic Granary Thick Bread 800g,1.95,£2.44/kg,bread,2026-04-01
Tesco White Plain Pitta Bread 6 Pack,0.5,£0.08/each,bread,2026-04-01
Tesco Finest Wholemeal Seeds & Grains Loaf 800g,1.6,£2.00/kg,bread,2026-04-01
Hovis Wholemeal Thick Sliced Bread 800g,1.35,£1.69/kg,bread,2026-04-01
Hovis Authentic Granary Wholemeal Sliced Bread 800g,1.95,£2.44/kg,bread,2026-04-01
Tesco Farmhouse Thick Sliced White Bread 800g,1.1,£1.38/kg,bread,2026-04-01
Warburtons Small Medium Sliced White Bread 400G,0.99,£2.48/kg,bread,2026-04-01
Hovis Seed Sensations Seven Seeds Sliced Bread 400g,1.15,£2.88/kg,bread,2026-04-01
Hovis Farmhouse Batch Wholemeal Bread with Oats 800g,1.65,£2.06/kg,bread,2026-04-01
Tesco Wholemeal Pitta Bread 6 Pack,0.5,£0.08/each,bread,2026-04-01
Hovis Tasty Wholemeal Medium Sliced Bread 400g,1.0,£2.50/kg,bread,2026-04-01
Warburtons Half & Half Thick Sliced Bread 800g,1.35,£1.69/kg,bread,2026-04-01
Warburtons Premium Old English Sliced White Bread 400g,1.9,£4.75/kg,bread,2026-04-01
Jason's Sourdough White Ciabattin Bread with Grains & Seeds 580g,2.2,£3.79/kg,bread,2026-04-01
Warburtons White Farmhouse Bread 400G,1.3,£3.25/kg,bread,2026-04-01
Hovis Authentic Granary Small Bread 400g,1.15,£2.88/kg,bread,2026-04-01
Jason's Superb Sprouted Grains Sourdough Bread 450g,2.2,£4.89/kg,bread,2026-04-01
Warburtons Soft White Pitta Breads 4 Pack,1.2,£0.30/each,bread,2026-04-01
Tesco Finest White Loaf 800g,1.6,£2.00/kg,bread,2026-04-01
Tesco Breaded Chicken Goujons 270g,2.5,£9.26/kg,bread,2026-04-01
Warburtons Soft Wholemeal Pitta Breads 4 Pack,1.2,£0.30/each,bread,2026-04-01
Hovis White 'n' Fibre Sliced Bread 800g,1.65,£2.06/kg,bread,2026-04-01
Tesco Breaded Chicken Steaks 4 Pack 380g,1.79,£4.71/kg,bread,2026-04-01
Tesco Breaded Chicken Steaks 4 Pack 505g,4.0,£7.92/kg,bread,2026-04-01
Tesco Cheese & Garlic Pizza Bread 236G,1.45,£6.14/kg,bread,2026-04-01
Warburtons White Sandwich Bread Thins 6 Pack,1.2,£0.20/each,bread,2026-04-01
Jacksons of Yorkshire Soft Champion White Bloomer Bread 800g,1.85,£2.31/kg,bread,2026-04-01
Tesco Finest Sliced Green Olive & Rosemary Sourdough Bread 400g,2.0,£5.00/kg,bread,2026-04-01
Jason's Protein Sourdough Sunflower Seeded Bread 580g,2.8,£4.83/kg,bread,2026-04-01
Wildfarmed Sliced Seeded Bread 550g,2.25,£4.09/kg,bread,2026-04-01
Tesco Free From White Bread 550g,1.95,£3.54/kg,bread,2026-04-01
Jason's Recipe No 09 Wholemeal Sourdough Ciabattin Bread 580g,2.2,£3.79/kg,bread,2026-04-01
Tesco Plain Naan Bread 2 Pack,1.35,£0.68/each,bread,2026-04-01
Tesco Free From Brown Bread 550g,1.95,£3.54/kg,bread,2026-04-01
Promise Gluten Free Soft White Sliced Bread 480g,3.6,£7.50/kg,bread,2026-04-01
Warburtons Gluten Free Multiseed Loaf Bread 300g,1.8,£6.00/kg,bread,2026-04-01
Clay Oven Bakery Hand Stretched Garlic & Coriander Naan Bread 2 Pack 360g,1.85,£5.14/kg,bread,2026-04-01
Schar Gluten-Free Soft White Sliced Bread Loaf,2.95,£9.83/kg,bread,2026-04-01
Tesco Free From Sliced Seeded Bread 550g,1.95,£3.54/kg,bread,2026-04-01
Tesco 4 Breaded Cod Fillets 500G,5.0,£10.00/kg,bread,2026-04-01
Warburtons Soft White Bread with Sourdough 400g,1.85,£4.62/kg,bread,2026-04-01
Tesco British Chicken Breast Fillets 650G,4.65,£7.15/kg,chicken,2026-04-01
Tesco Chicken Breast Fillets 320g,2.34,£7.31/kg,chicken,2026-04-01
Tesco British Chicken Breast Mini Fillets 400G,3.85,£9.62/kg,chicken,2026-04-01
Tesco British Chicken Breast Fillets 1KG,6.85,£6.85/kg,chicken,2026-04-01
Tesco Large Whole Chicken 1.7-2.1kg,5.15,£3.03/kg,chicken,2026-04-01
Tesco Medium Whole Chicken 1.3-1.7kg,3.95,£3.04/kg,chicken,2026-04-01
Tesco British Diced Chicken Breast 400G,3.85,£9.62/kg,chicken,2026-04-01
Tesco British Diced Chicken Breast 650G,5.1,£7.85/kg,chicken,2026-04-01
Tesco Chicken Breast Mini Fillets 650g,5.1,£7.85/kg,chicken,2026-04-01
Eastman's Sliced Cooked Chicken 240G,1.99,£8.29/kg,chicken,2026-04-01
Tesco Extra Large Whole Chicken 2.1-2.6kg,6.35,£3.02/kg,chicken,2026-04-01
Tesco Large Chicken Fillet Pack 1.6Kg,10.5,£6.56/kg,chicken,2026-04-01
Tesco British Chicken Thighs 1Kg,2.99,£2.99/kg,chicken,2026-04-01
Tesco Roast In The Bag Rotisserie Style Whole Chicken 1.5Kg,7.0,£4.67/kg,chicken,2026-04-01
Tesco British Chicken Thigh Fillets 1Kg,6.95,£6.95/kg,chicken,2026-04-01
Tesco British Chicken Thigh Fillets 600G,5.6,£9.33/kg,chicken,2026-04-01
Tesco British Chicken Drumsticks 1Kg,2.15,£2.15/kg,chicken,2026-04-01
Tesco Crispy Chicken Tenders 305g,4.2,£13.77/kg,chicken,2026-04-01
Tesco Buttered Chicken Breast Joint 565g,6.55,£11.59/kg,chicken,2026-04-01
Tesco British Chicken Legs 1Kg,2.25,£2.25/kg,chicken,2026-04-01
Butchers Choice Cooked Chicken Slices 340G,2.09,£6.15/kg,chicken,2026-04-01
Tesco British Chicken Drumstick Fillets 600g,2.95,£4.92/kg,chicken,2026-04-01
Eastman's Sliced Cooked Chicken Tikka 240G,1.99,£8.29/kg,chicken,2026-04-01
Tesco Flamegrilled Roast Chicken Slices 160g,3.0,£18.75/kg,chicken,2026-04-01
Tesco Slower Grown Chicken Breast Fillets 650g,7.7,£11.85/kg,chicken,2026-04-01
Tesco BBQ Roast Chicken Slices 160g,3.0,£18.75/kg,chicken,2026-04-01
Tesco British Roast Chicken Slices 120g,2.25,£18.75/kg,chicken,2026-04-01
Tesco Finest Roast Chicken 120g,3.75,£31.25/kg,chicken,2026-04-01
Tesco Finest British Cornfed Free Range Whole Chicken 1Kg-2.3Kg,7.5,£7.50/kg,chicken,2026-04-01
Tesco Chicken Breast Pieces 750g,5.95,£7.93/kg,chicken,2026-04-01
Tesco Roast In Bag Butter Basted Whole Chicken 1.5Kg,7.0,£4.67/kg,chicken,2026-04-01
Tesco 2 Roast Cooked Chicken Breast Fillets 245 G,3.85,£15.71/kg,chicken,2026-04-01
Tesco Wafer Thin Roast Chicken Slices 400g,2.19,£5.48/kg,chicken,2026-04-01
Tesco Chicken Wings 1KG,2.19,£2.19/kg,chicken,2026-04-01
Tesco Chicken Thighs 2Kg,5.5,£2.75/kg,chicken,2026-04-01
Birds Eye Chicken Dippers 22 Pack 403g,5.0,£12.41/kg,chicken,2026-04-01
Tesco Southern Fried Chicken Steaks 4 Pack 380g,1.79,£4.71/kg,chicken,2026-04-01
Butchers Choice Chicken Fillet 1.2 kg,5.1,£4.25/kg,chicken,2026-04-01
Tesco Wafer Thin Roast Chicken Slices 125g,1.25,£10.00/kg,chicken,2026-04-01
Tesco 2 Garlic and Herb Chicken Kievs 270g,3.25,£12.04/kg,chicken,2026-04-01
Tesco Buttermilk Chicken Tenders 305g,4.2,£13.77/kg,chicken,2026-04-01
Tesco Roast Chicken Slices 180g,3.75,£20.83/kg,chicken,2026-04-01
Tesco Breaded Chicken Steaks 4 Pack 380g,1.79,£4.71/kg,chicken,2026-04-01
Tesco Breaded Chicken Goujons 270g,2.5,£9.26/kg,chicken,2026-04-01
Tesco Crispy Chicken Breast Fillets 350g,4.2,£12.00/kg,chicken,2026-04-01
Tesco Southern Fried Chicken Tenders 305g,4.2,£13.77/kg,chicken,2026-04-01
Fridge Raiders Roast Chicken Bites 3X22.5G,1.65,£24.44/kg,chicken,2026-04-01
Tesco Chicken Mince 5% Fat 500G,2.49,£4.98/kg,chicken,2026-04-01
Tesco Breaded Chicken Steaks 4 Pack 505g,4.0,£7.92/kg,chicken,2026-04-01
Tesco Cajun Chicken Escalopes 350g,4.5,£12.86/kg,chicken,2026-04-01
Tesco Hot & Spicy Chicken Tenders 305g,4.2,£13.77/kg,chicken,2026-04-01
Tesco Sweet Chilli Roast Chicken Slices 160g,3.0,£18.75/kg,chicken,2026-04-01
Tesco Battered Chicken Dippers 20 Pack 450g,1.65,£3.67/kg,chicken,2026-04-01
"Tesco Finest Roast Chicken Breast with Pork, Sage & Onion Stuffing 120g",3.75,£31.25/kg,chicken,2026-04-01
Tesco Finest Parmesan Parmigiana Crispy Chicken Breasts 420g,6.0,£14.29/kg,chicken,2026-04-01
Tesco Organic 2 Chicken Fillets,5.75,£23.00/kg,chicken,2026-04-01
Diggerscrispy Shredded Chicken 320G,3.85,£12.03/kg,chicken,2026-04-01
Tesco 4 Roast Cooked Chicken Breast Fillets 485G,6.0,£12.37/kg,chicken,2026-04-01
Tesco Finest Lemon Crispy Chicken Schnitzel 355g,6.0,£16.90/kg,chicken,2026-04-01
Tesco Buttermilk Chicken Strips 400g,4.1,£10.25/kg,chicken,2026-04-01
Fridge Raiders Slow Roasted Chicken Bites 5X22.5G,2.55,£22.67/kg,chicken,2026-04-01
Tesco Sweet Chilli Chicken Escalopes 316G,4.5,£14.24/kg,chicken,2026-04-01
Tesco Chicken Drumsticks 2Kg,4.3,£2.15/kg,chicken,2026-04-01
Birds Eye 2 Crispy Chicken 170G,1.5,£8.82/kg,chicken,2026-04-01
Tesco Garlic & Herb Chicken Kievs 375g,4.65,£12.40/kg,chicken,2026-04-01
Tesco 4 Bbq Chicken & Chorizo Kebabs 272G,5.0,£18.38/kg,chicken,2026-04-01
Tesco Chicken Breast Fillet 1Kg,7.0,£7.00/kg,chicken,2026-04-01
Tesco Organic Whole Chicken,15.0,£10.00/kg,chicken,2026-04-01
Diggers Batter Chicken Balls 320G,3.85,£11.32/kg,chicken,2026-04-01
Tesco Fajita Cooked Chicken Breast Mini Fillets 170G,3.25,£19.12/kg,chicken,2026-04-01
Eastman's Hot & Spicy Sliced Chicken 240G,1.99,£8.29/kg,chicken,2026-04-01
Birds Eye Chicken Shop Buttermilk Chicken Tenders 300G,4.5,£15.00/kg,chicken,2026-04-01
Clarence Court Traditional Leghorn Whites Free Range Eggs 6 Pack,2.85,£0.48/each,eggs,2026-04-01
St.Ewe Rich Yolk Free Range Eggs 6 Pack,2.95,£0.49/each,eggs,2026-04-01
Big & Fresh Barn Eggs Large 10 Pack,2.55,£0.26/each,eggs,2026-04-01
Happy Egg Free Range Eggs Large 10 Pack,3.75,£0.38/each,eggs,2026-04-01
Happy Egg Free Range Eggs Medium 6 Pack,2.35,£0.39/each,eggs,2026-04-01
Freshlay Golden Yolks Free Range Eggs 10 Pack 540G,4.05,£0.40/each,eggs,2026-04-01
Cadbury Mini Eggs 74g,2.0,£27.03/kg,eggs,2026-04-01
Happy Egg Free Range Eggs Large 6 Pack,2.55,£0.42/each,eggs,2026-04-01
Big & Free Large White Free Range Eggs 10 Pack,3.35,£0.34/each,eggs,2026-04-01
St. Ewe Rich Yolk Large Free-Range Eggs 6 Pack,3.3,£0.55/each,eggs,2026-04-01
Tesco Finest Free Range 6 Golden Yolk Eggs,2.9,£0.48/each,eggs,2026-04-01
Happy Egg Co. Free Range Eggs 10 Mixed Weight,3.45,£0.34/each,eggs,2026-04-01
Tesco Mixed Sized Organic Eggs 6 Pack,2.8,£8.54/kg,eggs,2026-04-01
Tesco Free Range Eggs Very Large 6 Pack,2.4,£0.40/each,eggs,2026-04-01
Cadbury Creme Egg 5 Pack 200G,4.0,£20.00/kg,eggs,2026-04-01
Tesco Finest 6 Free Range Chestnut Maran Eggs,2.9,£0.48/each,eggs,2026-04-01
Cadbury Mini Eggs Shell Egg 95g,2.0,£21.05/kg,eggs,2026-04-01
Cadbury Creme Egg Chocolate Eggs Mixed 5 Pack 200g,4.0,£20.00/kg,eggs,2026-04-01
Purely Organic Eggs Mixed Weight 10 Pack,5.2,£0.52/each,eggs,2026-04-01
St Ewe Original Large Free Range Eggs 10 Pack,3.95,£0.40/each,eggs,2026-04-01
Tesco Egg Custard Tarts 4 Pack,1.05,£0.26/each,eggs,2026-04-01
Cadbury Dairy milk Buttons Shell EASTER Egg 90g,2.0,£22.22/kg,eggs,2026-04-01
Cadbury Dairy Milk Freddo Faces Easter Egg 90g,2.0,£22.22/kg,eggs,2026-04-01
Cadbury Creme Egg Chocolate Eggs 8 pack 320g,6.0,£18.75/kg,eggs,2026-04-01
ST. EWE FREE RANGE EGGS Original Family Pack Mixed Weight 15 Eggs,4.85,£0.32/each,eggs,2026-04-01
Tesco Egg Noodles 300G,1.1,£3.67/kg,eggs,2026-04-01
St. Ewe Original Free Range Eggs Medium 6 Pack,2.4,£0.40/each,eggs,2026-04-01
Tesco Scotch Eggs 2 Pack 227G,1.09,£4.80/kg,eggs,2026-04-01
Cadbury Caramel Egg 5 Pack 195G,4.0,£20.51/kg,eggs,2026-04-01
Terry's Chocolate Orange Easter Egg with Mini Eggs 200g,4.5,£22.50/kg,eggs,2026-04-01
Cadbury Mini Eggs Family Pack 256g,6.2,£24.22/kg,eggs,2026-04-01
Tesco Finest Free Range Bluebell Araucana Eggs 6 Pack,2.9,£0.48/each,eggs,2026-04-01
Tony's Chocolonely 12 Egg-Stra Special Chocolate Eggs 150G,4.5,£30.00/kg,eggs,2026-04-01
Terry's White Chocolate Orange Easter Egg And Mini Eggs 200G,4.5,£22.50/kg,eggs,2026-04-01
Cadbury Orange Mini Eggs 74g,2.0,£27.03/kg,eggs,2026-04-01
Cadbury Twirl Shell Egg 171g,4.5,£26.32/kg,eggs,2026-04-01
Two Chicks Liquid Egg Whites 500 Ml,3.5,£7.00/litre,eggs,2026-04-01
Tesco Egg Hunt Basket 340G,6.0,£17.65/kg,eggs,2026-04-01
Smarties Mini Eggs 80G,1.75,£21.88/kg,eggs,2026-04-01
Kit Kat Chunky Easter Egg 110g,2.0,£18.18/kg,eggs,2026-04-01
Cadbury White Buttons Shell Egg 91g,2.0,£21.98/kg,eggs,2026-04-01
Milkybar White Chocolate Mini Eggs Giant Easter Egg 230g,7.0,£30.44/kg,eggs,2026-04-01
Tesco Medium Egg Noodles 250G,0.95,£3.80/kg,eggs,2026-04-01
Cadbury Crunchie Shell Egg 167g,4.5,£26.95/kg,eggs,2026-04-01
Cadbury Wispa Shell egg 177g,4.5,£25.42/kg,eggs,2026-04-01
Cadbury Creme Egg Shell 190g,4.5,£23.68/kg,eggs,2026-04-01
KITKAT Milk Chocolate Mini Eggs 80g,1.75,£21.88/kg,eggs,2026-04-01
Galaxy Milk Chocolate Minstrels Easter Egg 162g,4.5,£27.78/kg,eggs,2026-04-01
Kinder Surprise Egg 3 X 20G,3.0,£50.00/kg,eggs,2026-04-01
Cadbury Dairy Milk Caramel Nibbles Shell Egg 88g,2.0,£22.73/kg,eggs,2026-04-01
Cadbury Twirl Orange Shell Egg 193g,4.5,£23.32/kg,eggs,2026-04-01
Kinder Bueno Mini Easter Eggs 80g,3.65,£45.62/kg,eggs,2026-04-01
Bounty Milk Chocolate Easter Egg 177g,4.5,£25.42/kg,eggs,2026-04-01
Cadbury Mini Egg 287g,5.75,£20.04/kg,eggs,2026-04-01
Celebrations Milk Chocolate Easter Egg 189g,4.5,£23.81/kg,eggs,2026-04-01
Twix Milk Chocolate Easter Egg 170g,4.5,£26.47/kg,eggs,2026-04-01
Yorkie Milk Chocolate Easter Egg 196G,4.5,£22.96/kg,eggs,2026-04-01
Cadbury White Creme Egg 5x40g,4.0,£20.00/kg,eggs,2026-04-01
Maltesers Teasers Milk Chocolate Easter Egg 155g,4.5,£29.03/kg,eggs,2026-04-01
St Ewe Super Eggs 6 Pack,2.75,£0.46/each,eggs,2026-04-01
Cadbury Dairy Milk Caramel  Shell Egg 190g,4.5,£23.68/kg,eggs,2026-04-01
Cadbury White Creme Easter Egg Shell 190g,4.5,£23.68/kg,eggs,2026-04-01
Birds Eye 4 Battered Fish Fillets 400G,2.45,£6.12/kg,fish,2026-04-01
Tesco 2 Boneless Salmon Fillets 260G,4.8,£18.46/kg,fish,2026-04-01
Tesco 2 Skinless & Boneless Basa Fillets 250G,1.79,£7.16/kg,fish,2026-04-01
Youngs Gastro Signature Breaded Lemon & Pepper 2 Fish Fillets 270G,5.25,£19.44/kg,fish,2026-04-01
Bay Fishmongers White Fish Fillets 520G,2.35,£4.52/kg,fish,2026-04-01
Tesco 2 Skinless Smoked Basa Fillets 240G,1.79,£7.46/kg,fish,2026-04-01
Hearty Food Co 4 Battered White Fish Fillets 400G,1.99,£4.98/kg,fish,2026-04-01
Tesco Lightly Dusted Cod Fillets 255G,5.5,£21.57/kg,fish,2026-04-01
Youngs Gastro 2 Tempura Battered Fish Fillets 270G,5.25,£19.44/kg,fish,2026-04-01
Tesco Battered Cod Fillet Bites 200G,3.0,£15.00/kg,fish,2026-04-01
Tesco 4 Breaded Cod Fillets 500G,5.0,£10.00/kg,fish,2026-04-01
Tesco Finest 2 Skinless & Boneless Cod Loins 300g,5.0,£16.67/kg,fish,2026-04-01
Tesco 2 Boneless Sea Bass Fillets 180G,5.95,£33.06/kg,fish,2026-04-01
Youngs Chip Shop 4 Omega 3 Fish Fillets,4.25,£10.62/kg,fish,2026-04-01
Young's Chip Shop Extra Large Beer Batter Fish Fillets 300g,4.35,£14.50/kg,fish,2026-04-01
Youngs Gastro 2 Crispy Lemon Basa Fillets 310G,5.25,£16.94/kg,fish,2026-04-01
Birds Eye Omega 3 Fish Fingers 10 Pack 280g,3.0,£10.71/kg,fish,2026-04-01
Tesco 2 Breaded Chunky Cod Fillets 350G,5.25,£15.00/kg,fish,2026-04-01
Tesco Lightly Dusted Haddock Fillets 255G,5.5,£21.57/kg,fish,2026-04-01
Tesco Tuna Chunks In Spring Water 4 X 145G,2.49,£6.10/kg DR.WT,fish,2026-04-01
Tesco Smoked Salmon 100g,3.75,£37.50/kg,fish,2026-04-01
Tesco Breaded Chunky Haddock Fillets 350g,5.25,£15.00/kg,fish,2026-04-01
Tesco Boneless Smoked Haddock 280G,7.6,£27.14/kg,fish,2026-04-01
Birds Eye 4 Breaded Cod Fillets 400g,6.6,£16.50/kg,fish,2026-04-01
Birds Eye Captain's Discoveries Lightly Dusted Fish Fillets with Sea Salt & Rosemary 280g,4.5,£16.07/kg,fish,2026-04-01
Birds Eye 6 Crispy Battered Fish Fingers Extra Large 360G,3.75,£10.42/kg,fish,2026-04-01
Tesco Cod Fillets 360G,5.5,£15.28/kg,fish,2026-04-01
Tesco Fish Pie Mix 340G,6.5,£19.12/kg,fish,2026-04-01
Youngs Gastro 2 Sea Salt & Pepper Basa Fillets 310G,5.25,£16.94/kg,fish,2026-04-01
Birds Eye 4 Battered Cod Fillets 400g,6.6,£16.50/kg,fish,2026-04-01
Hearty Food Co 4 Breaded White Fish Fillets 400G,1.99,£4.98/kg,fish,2026-04-01
Tesco Finest Skinless & Boneless Cod Loins 280G,8.1,£28.93/kg,fish,2026-04-01
Tesco Finest 2 Cod & Parsley Fishcakes 290G,3.6,£12.41/kg,fish,2026-04-01
Tesco Finest 2 Smoked Haddock Fishcakes 290G,3.6,£12.41/kg,fish,2026-04-01
Tesco 2 Boneless Mackerel Fillets 160G,3.95,£24.69/kg,fish,2026-04-01
Birds Eye 2 Battered Fish Fillets 200G,1.5,£7.50/kg,fish,2026-04-01
Hearty Food Co. 4 Breaded Fish Fillets 600G,2.99,£4.98/kg,fish,2026-04-01
Tesco Omega 3 Fish Fingers 10 Pack 300g,0.93,£3.10/kg,fish,2026-04-01
Tesco Simply Salmon & Dill Parcels 275G,5.4,£19.64/kg,fish,2026-04-01
Tesco Basa Fillets 500G,5.5,£11.00/kg,fish,2026-04-01
Tesco Fish Pie Mix 400G,6.0,£15.00/kg,fish,2026-04-01
Tesco Boneless Haddock Fillets 280G,5.85,£20.89/kg,fish,2026-04-01
Hearty Food Co 4 Fish Steaks In Butter Sauce 552G,2.7,£4.89/kg,fish,2026-04-01
Tesco Skinless Boneless Scottish Mackerel In Tomato Sauce 125G,1.3,£10.40/kg,fish,2026-04-01
Tesco 4 Wild Salmon Fillets 330G,5.5,£16.67/kg,fish,2026-04-01
Tesco Boneless Salmon Half Side 500g,9.2,£18.40/kg,fish,2026-04-01
Tesco Finest 2 Beer Battered Cod Fillets 300g,4.1,£13.67/kg,fish,2026-04-01
Tesco Haddock Fillets 360G,5.5,£15.28/kg,fish,2026-04-01
Tesco 2 Boneless Cod Fillets 280G,7.8,£27.86/kg,fish,2026-04-01
Tesco 2 Lemon & Pepper Sea Bass Fillets 200G,5.95,£29.75/kg,fish,2026-04-01
Tesco 4 Breaded Haddock Fillets 500G,5.0,£10.00/kg,fish,2026-04-01
Tesco Finest 6 Chunky Cod Fillets Fish Fingers 400G,4.4,£11.00/kg,fish,2026-04-01
Youngs Chip Shop Jumbo Fish Special 480g,5.0,£10.42/kg,fish,2026-04-01
Hearty Food Co 10 Cod Fish Cakes 500g,2.0,£4.00/kg,fish,2026-04-01
Tesco Cod Fish Fingers 10 Pack 300G,1.99,£6.63/kg,fish,2026-04-01
Tesco 2 Cod Fishcakes 270G,2.5,£9.26/kg,fish,2026-04-01
Hearty Food Co Fish Fingers 10 Pack 250g,0.8,£3.20/kg,fish,2026-04-01
Tesco Tuna Chunks In Spring Water 145G,0.65,£6.37/kg DR.WT,fish,2026-04-01
Princes Tuna Chunks In Spring Water 4X145g,4.3,£10.54/kg DR.WT,fish,2026-04-01
Birds Eye 2 Breaded Fish Fillets 200G,1.5,£7.50/kg,fish,2026-04-01
Tesco Battered Haddock Goujons 200G,2.75,£13.75/kg,fish,2026-04-01
Tesco Cod Mornay 360g,5.9,£16.39/kg,fish,2026-04-01
Tesco 4 Battered Chunky Cod Fillets 500G,6.25,£12.50/kg,fish,2026-04-01
Tesco Mackerel in Spring Water 125g,1.3,£14.77/kg DR.WT,fish,2026-04-01
Tesco 2 Cod Fillets With Broccoli and a Mornay Sauce 360g,5.5,£15.28/kg,fish,2026-04-01
Birds Eye Gluten Free Breaded Fish Fillets 250G,3.85,£15.40/kg,fish,2026-04-01
Tesco Finest Yellow Fin Tuna Steaks 280g,5.0,£17.86/kg,fish,2026-04-01
Birds Eye 8 Breaded Haddock Fish Fingers 240g,4.25,£17.71/kg,fish,2026-04-01
Tesco Finest 2 Cod & Chorizo Fishcakes 290G,3.6,£12.41/kg,fish,2026-04-01
Mowi 2 Scottish Salmon Fillets 230G,5.95,£25.87/kg,fish,2026-04-01
"Tesco British Semi Skimmed Milk 2.272L, 4 Pints",1.65,£0.73/litre,milk,2026-04-01
"Tesco British Whole Milk 2.272L, 4 Pints",1.65,£0.73/litre,milk,2026-04-01
"Tesco British Semi Skimmed Milk 1.13L, 2 Pints",1.2,£1.06/litre,milk,2026-04-01
"Tesco British Whole Milk 1.13L, 2 Pints",1.2,£1.06/litre,milk,2026-04-01
"Tesco British Skimmed Milk 2.272L, 4 Pints",1.65,£0.73/litre,milk,2026-04-01
Arla Big Milk Fresh Whole Milk  2L Vitamin Enriched for kids 1+,2.75,£1.38/litre,milk,2026-04-01
Cravendale Filtered Fresh Semi Skimmed Milk 2L Fresher for Longer,2.5,£1.25/litre,milk,2026-04-01
"Tesco British Semi Skimmed Milk 568 Ml, 1 Pint",0.85,£1.50/litre,milk,2026-04-01
"Tesco British Skimmed Milk 1.136L, 2 Pints",1.2,£1.06/litre,milk,2026-04-01
Tesco Filtered Semi Skimmed Milk 2 Litre,2.1,£1.05/litre,milk,2026-04-01
Cravendale Filtered Fresh Whole Milk 2L Fresher for Longer,2.5,£1.25/litre,milk,2026-04-01
"Tesco British Whole Milk 568Ml, 1 Pint",0.85,£1.50/litre,milk,2026-04-01
Tesco Organic British Semi Skimmed Milk 2.272L/4 Pints,2.45,£1.08/litre,milk,2026-04-01
Tesco British Semi Skimmed Longlife Uht Milk 1 Litre,1.35,£1.35/litre,milk,2026-04-01
Arla BOB Skimmed Milk 2L Tastes like Semi Skimmed,2.5,£1.25/litre,milk,2026-04-01
Tesco Milk Chocolate Digestive Biscuits 300G,1.2,£4.00/kg,milk,2026-04-01
Cravendale Filtered Fresh Semi Skimmed Milk 1L Fresher for Longer,1.75,£1.75/litre,milk,2026-04-01
Creamfields Semi Skimmed UHT Milk 1L,0.69,£0.69/litre,milk,2026-04-01
Tesco Filtered Whole Milk 2 Litre,2.1,£1.05/litre,milk,2026-04-01
Tesco British Semi Skimmed Uht Milk 6 X 1 Litre,6.15,£1.02/litre,milk,2026-04-01
Tesco Organic British Whole Milk 2.272L/4 Pints,2.45,£1.08/litre,milk,2026-04-01
Tesco Finest Jersey Whole Milk 1L,1.85,£1.85/litre,milk,2026-04-01
Graham's Gold Jersey Milk 1 Litre,1.95,£1.95/litre,milk,2026-04-01
Tesco Coconut Milk 400Ml,0.75,£1.88/litre,milk,2026-04-01
